{
  "schema_version": "task02-m2-execution-view/2",
  "basis": {
    "session_id": "session-cbc83429a24141b089cb8868c7b4b6bd",
    "root_sha256": "43d2f1b3e20534bc40d34560e93284886259a1168a3b374df49c0928b6eff851",
    "head_sha256": "e8a5636f9aa172f1232179b896d4f8de415955cac173d9afea4c2bf3e53b5941",
    "head_version": "1",
    "generation": "0",
    "source_sha256": "f3d61f90a78445a13b3e9894842294940289cd47406179cb58b63f4cda7fdf47",
    "context_version": "4038941ccdf51d04d471e31050e5c58da2cf50c089e6a681fd558e1c0f9e17b9",
    "overlay_sha256": null,
    "build_sha256": "80694f511dc735d0b6a1a0a830edd7f6267df395e87dad0ccf180914b49d5a41"
  },
  "execution_mode": "SIMULATED_REPLAY",
  "real_world_observation": false,
  "current_time": "2026-09-27T21:00:00+07:00",
  "order_ids": [
    "O001",
    "O002",
    "O003"
  ],
  "delivered_prefix": [],
  "planned_served_suffix": [],
  "unserved": [
    {
      "order_id": "O001",
      "reason": "NO_ACCEPTED_PLAN"
    },
    {
      "order_id": "O002",
      "reason": "NO_ACCEPTED_PLAN"
    },
    {
      "order_id": "O003",
      "reason": "NO_ACCEPTED_PLAN"
    }
  ],
  "metric_scope": "OBSERVED_PREFIX_ONLY",
  "observed_metrics": null,
  "vehicles": [
    {
      "vehicle_id": "V1",
      "availability": "AVAILABLE",
      "current_load_kg": 0,
      "onboard_order_ids": [],
      "capacity_kg": 15,
      "remaining_range_m": 120000,
      "position": {
        "kind": "AT_NODE",
        "node_id": 366428309,
        "coordinates": [
          106.7161639,
          10.8022693
        ]
      }
    },
    {
      "vehicle_id": "V2",
      "availability": "AVAILABLE",
      "current_load_kg": 0,
      "onboard_order_ids": [],
      "capacity_kg": 15,
      "remaining_range_m": 120000,
      "position": {
        "kind": "AT_NODE",
        "node_id": 366428309,
        "coordinates": [
          106.7161639,
          10.8022693
        ]
      }
    }
  ],
  "active_job_id": null,
  "pending_event_ids": [],
  "planned_suffix_metrics": null,
  "projected_whole_metrics": null,
  "accepted_trajectory": null
}